<?xml version="1.0" encoding="UTF-8"?>
<!DOCTYPE store SYSTEM "../dtd/store_DTD.dtd">
<?xml-model href="../xsd/store_XSD.xsd"?>
<store>
    <name>WebsiteName</name>
    <business>
        <name>BusinessName</name>
        <location>
            <street>12 Street</street>
            <postcode>01009</postcode>
            <city>Vitoria-Gasteiz</city>
            <province>√Ålava</province>
            <country>Spain</country>
        </location>
    </business>
    <personel>
        <roles>
            <role id="CEO">
                <name>Chief Executive Officer</name>
            </role>
            <role id="CS">
                <name>Customer Support</name>
            </role>
        </roles>
        <management>
            <employee id="CM-001">
                <name>Urtzi</name>
                <age>19</age>
                <position role="CEO" />
            </employee>
            <employee id="CM-002">
                <name>Alesandro</name>
                <age>18</age>
                <position role="CEO" />
            </employee>
        </management>
        <staff>
            <employee id="CS-010">
                <name>a</name>
                <age>21</age>
                <position role="CS" />
                <infractions>0</infractions>
            </employee>
            <employee id="CS-011">
                <name>c</name>
                <age>23</age>
                <position role="CS" />
                <infractions>1</infractions>
            </employee>
        </staff>
    </personel>
    <sellers>
        <company id="ORA">
            <name>and</name>
            <web>https://yes.com</web>
        </company>
        <company id="AND">
            <name>or</name>
            <web>https://aaaaa.com</web>
        </company>
    </sellers>
    <vat>15</vat>
    <storage>
        <product id="AC-2562" company="ORA">
            <name>And</name>
            <price currency="euro">5.99</price>
            <image>h</image>
        </product>
        <product id="OC-7278" company="AND">
            <name>oo</name>
            <price currency="dollar">688</price>
            <image>hh</image>
        </product>
        <product id="XO-7567" company="XOR">
            <name>Xor</name>
            <price currency="euro">5.99</price>
            <image>h</image>
        </product>
    </storage>
    <services>
        <service id="AA-3667">
            <name>jdasjhk</name>
            <price currency="euro">788</price>
            <image>jhgfdsgh</image>
        </service>
        <service id="OC-8278">
            <name>oo</name>
            <price currency="dollar">688</price>
            <image>hh</image>
        </service>
        <service id="XO-2578">
            <name>pasljd</name>
            <price currency="euro">120</price>
            <image>yy</image>
        </service>
    </services>
</store>
